,,title,description,skill
ec,1074,Fundamentals of Statistics,"Statistics is the science of turning data into insights and ultimately decisions. Behind recent advances in machine learning, data science and artificial intelligence are fundamental statistical principles. The purpose of this class is to develop and understand these core ideas on firm mathematical grounds starting from the construction of estimators and tests, as well as an analysis of their asymptotic performance.<br /><br />After developing basic tools to handle parametric models, we will explore how to answer more advanced questions, such as the following:<br />
<ul>
<li>How suitable is a given model for a particular dataset?</li>
<li>How to select variables in linear regression?</li>
<li>How to model nonlinear phenomena?</li>
<li>How to visualize high-dimensional data?</li>
</ul>
Taking this class will allow you to expand your statistical knowledge to not only include a list of methods, but also the mathematical principles that link them together, equipping you with the tools you need to develop new ones.<br /><br />This course is part of the <a href=""https://www.edx.org/micromasters/mitx-statistics-and-data-science"" target=""_blank"" rel=""noopener noreferrer"">MITx MicroMasters Program in Statistics and Data Science</a>. Master the skills needed to be an informed and effective practitioner of data science. You will complete this course and three others from MITx, at a similar pace and level of rigor as an on-campus course at MIT, and then take a virtually-proctored exam to earn your MicroMasters, an academic credential that will demonstrate your proficiency in data science or accelerate your path towards an MIT PhD or a Master's at other universities. To learn more about this program, please visit <a href=""https://micromasters.mit.edu/ds/"" target=""_blank"" rel=""noopener noreferrer"">https://micromasters.mit.edu/ds/</a>.</strong>",Statistics
ec,1075,Machine Learning with Python: from Linear Models to Deep Learning,"Machine learning methods are commonly used across engineering and sciences, from computer systems to physics. Moreover, commercial sites such as search engines, recommender systems (e.g., Netflix, Amazon), advertisers, and financial institutions employ machine learning algorithms for content recommendation, predicting customer behavior, compliance, or risk.<br /><br />As a discipline, machine learning tries to design and understand computer programs that learn from experience for the purpose of prediction or control.&nbsp; <br /><br />In this course, students will learn about principles and algorithms for turning training data into effective automated predictions.&nbsp; We will cover:<br />
<ul>
<li>Representation, over-fitting, regularization, generalization, VC dimension;</li>
<li>Clustering, classification, recommender problems, probabilistic modeling, reinforcement learning;</li>
<li>On-line algorithms, support vector machines, and neural networks/deep learning.</li>
</ul>
Students will implement and experiment with the algorithms in several Python projects designed for different practical applications.<br /><br />This course is part of the <a href=""https://www.edx.org/micromasters/mitx-statistics-and-data-science"" target=""_blank"" rel=""noopener noreferrer"">MITx MicroMasters Program in Statistics and Data Science</a>. Master the skills needed to be an informed and effective practitioner of data science. You will complete this course and three others from MITx, at a similar pace and level of rigor as an on-campus course at MIT, and then take a virtually-proctored exam to earn your MicroMasters, an academic credential that will demonstrate your proficiency in data science or accelerate your path towards an MIT PhD or a Master's at other universities. To learn more about this program, please visit <a href=""https://micromasters.mit.edu/ds/"" target=""_blank"" rel=""noopener noreferrer"">https://micromasters.mit.edu/ds/</a>.</strong><br /><br />If you have specific questions about this course, please contact us at <a href=""mailto:sds-mm@mit.edu"" target=""_blank"" rel=""noopener noreferrer"">sds-mm@mit.edu</a>.</em></strong>",Machine Learning
ec,1077,Computer Vision and Image Analysis,"This course is part of the <a href=""https://www.edx.org/microsoft-professional-program-artificial-intelligence"" target=""_blank"" rel=""noopener noreferrer"">Microsoft Professional Program in Artificial Intelligence</a>.</em><br /><br />Computer Vision is the art of distilling actionable information from images. <br /><br />In this hands-on course, we&rsquo;ll learn about Image Analysis techniques using OpenCV and the Microsoft Cognitive Toolkit to segment images into meaningful parts. We&rsquo;ll explore the evolution of Image Analysis, from classical to Deep-Learning techniques. <br /><br />We&rsquo;ll use Transfer Learning and Microsoft ResNet to train a model to perform Semantic Segmentation.<br /><br />edX offers financial assistance for learners who want to earn Verified Certificates but who may not be able to pay the fee. To apply for financial assistance, enroll in the course, then follow <a href=""https://courses.edx.org/financial-assistance/"">this link</a> to complete an application for assistance.",Microsoft Cognitive Toolkit
ec,1096,Strategic Leadership in Healthcare,"This course is part of the Healthcare Administration MicroMasters program which consists of 7 courses and a capstone exam. After completing the program, you can also apply to Doane University to complete your MBA online</strong> for approximately $10,500 (learn more about the program <a title=""Doane University MBA"" href=""https://www.doane.edu/lp/healthcare-admin.html?r_source=Web%20-%20HCA"" target=""_blank"" rel=""noopener noreferrer"">here</a>).<br /><br />Leading organizational change can be a challenge for anyone. Doing so in a large, heavily-regulated environment such as healthcare without the&nbsp;proper tools to develop, coach, and mentor employees is a recipe for failure. Such dynamic environments call for skilled, strong leaders to guide the way and develop successful, functional teams.&nbsp;<br /><br />Learn foundational skills critical to leaders, including communication skills, coaching, mentoring, negotiation, and motivation theory. This course will also explore team development through facilitation and collaboration. Assess your personal style of leadership by learning more about strengths and areas of improvement. This course will also focus on practical strategic thinking practices, leadership theories and leadership style development, and how leadership style can be used to think and act strategically.",Leadership
ec,1107,Communicating Effectively: How to Inspire and Convince,"In order to be effective, leaders need a high tolerance of complexity. Beyond this, they need to inform their people and the outside world of their strategies, policies and decisions. Effective leaders are often inspiring communicators - their own high tolerance of complexity helps them reduce this complexity to a concise and powerful message. <br /><br />Your sensemaking mindset is therefore of critical importance to motivate others to follow and support you. Your ability to inspire and convince is largely dependent on the way you frame your message, and on your skills at playing the game of framing and reframing. You will learn from a large variety of (video) cases and analyse a large number of situations where leaders&rsquo; communication and sensemaking skills are tested and probed. This will ensure that you are equipped to build winning coalitions in your own organization. <br /><br />LICENSE</em><br /><br />The course materials of this course are Copyright Delft University of Technology and are licensed under a Creative Commons Attribution-NonCommercial-ShareAlike (CC-BY-NC-SA) 4.0 International License.</em>",Communication Skills
ec,1114,Blockchain Technology,"Developed by Blockchain at Berkeley and faculty from UC Berkeley's premier Computer Science department, this course provides a wide overview of many of the topics relating to and building upon the foundation of Bitcoin and blockchain technology.<br /><br />The course covers many key topics in the blockchain space. First, we take a look at distributed systems and alternative consensus mechanisms, as well as cryptoeconomic and proof-of-stake. We then move on to the fundamental applications of bitcoin and blockchain technology, including exploring enterprise blockchain implementations (JP Morgan&rsquo;s Quorum, Ripple, Tendermint, and HyperLedger), the challenges and solutions around scaling blockchain adoption, and the measures that the government is taking to regulate and control blockchain technology. We wrap up the course by also taking a look at the various blockchain ventures today and conclude with a blockchain-based future thought experiment. <br /><br />This course is open to anyone with any background. Whether you are planning your next career move as a blockchain developer, crypto trader, data analyst, researcher, or consultant, or are just looking for an introduction to Blockchain.&nbsp;This course will help you begin&nbsp;to develop the critical skills needed to future-proof your career. <br /><br />This is the second course in the Blockchain Fundamentals Professional Certificate program.",Blockchain
ec,1115,Computing in Python I: Fundamentals and Procedural Programming,"This course starts from the beginning, covering the basics of how a computer interprets lines of code; how to write programs, evaluate their output, and revise the code itself; how to work with variables and their changing values; and how to use mathematical, boolean, and relational operators.<br /><br />By the end of this course, you'll be able to write small programs in Python that use variables, mathematical operators, and logical operators. For example, you could write programs that carry out complex mathematical operations, like calculating the interest rate necessary to reach a savings goal, recommending apparel options based on weather patterns, or calculating a grade based on multiple percentages. <br /><br />Structurally, the course is comprised of several parts. Instruction is delivered via a series of short (2-3 minute) videos. In between those videos, you'll complete both multiple choice questions and coding problems to demonstrate your knowledge of the material that was just covered.",Python
ec,1116,Computing in Python II: Control Structures,"Building on your prior knowledge of variables and operators, this course gets into the meat of programming. Organized into five chapters, this course starts by covering the fundamentals of what control structures are and what they do, then moves on to four common control structures in Python. Conditionals let you modify what your program does based on the values of incoming variables. Loops let you repeat tasks for multiple values or while certain conditions hold true. Functions let you encapsulate complex reasoning into reusable chunks of code. Error handling lets you intelligently recover from anticipated and unanticipated glitches.<br /><br />By the end of this course, you'll be able to write complex programs in Python that perform useful reasoning. For example, you could write a program that calculates your weight on other planets, calculates the standard deviation of a series of numbers, or checks for the validity of an incoming password.<br /><br />Structurally, the course is comprised of several parts. Instruction is delivered via a series of short (2-3 minute) videos. In between those videos, you'll complete both multiple choice questions&nbsp; and coding problems to demonstrate your knowledge of the material that was just covered.",Python
ec,1117,Computing in Python III: Data Structures,"Build on your existing knowledge of conditionals, loops, and functions by studying more about complex Python data structures, including strings, lists, dictionaries, and file input and output. Organized into five chapters, this course starts by covering the basics of data structures, then moves on to these four common data structures in Python:<br />
<ul>
<li>Strings let you perform far more complex reasoning with text.</li>
<li>Lists let you process long lists of data, and even lists of lists of data for more complex reasoning.</li>
<li>Dictionaries let you more clearly code for complex types of data, and even simulate some basic elements of object-oriented programming.</li>
<li>File input and output brings your programs to life, allowing you to persist data across executions of the same program.</li>
</ul>
<br />By the end of this course, you'll be able to write even more complex programs in Python that process and persist complex data structures. For example, you'll be able to write an ongoing gradebook application that tracks and updates your average over time, a program to calculate the net force based on several force magnitudes and directions, or a program that can turn a string like this into a StRiNg LiKe tHiS.<br /><br />Structurally, the course is comprised of several parts. Instruction is delivered via a series of short (2-3 minute) videos. In between those videos, you'll complete both multiple choice questions and coding problems to demonstrate your knowledge of the material that was just covered.",Python
ec,1118,Computing in Python IV: Objects & Algorithms,"Complete your introductory knowledge of computer science with this final course on objects and algorithms. Now that you've learned about complex control structures and data structures, learn to develop programs that more intuitively leverage your natural understanding of problems through object-oriented programming. Then, learn to analyze the complexity and efficiency of these programs through algorithms. In addition, certify your broader knowledge of Introduction to Computing with a comprehensive exam.<br /><br />By the end of this course, you'll be able to write programs in Python that leverage your more natural understanding of data structures by creating objects to represent the structures you work with most often. For example, if you were creating a class roster application, you'll learn how to create an object representing a student's name, ID number, and attendance record. Then, you'll be able to create applications that leverage sorting and searching algorithms to sort that roster alphabetically, search for a particular student, and evaluate the efficiency of both those operations.<br /><br />Structurally, the course is comprised of several parts. Instruction is delivered via a series of short (2-3 minute) videos. In between those videos, you'll complete both multiple choice questions and coding problems to demonstrate your knowledge of the material that was just covered. These exercises count for 20% of your grade. Then, after each major chapter, you'll complete a problem set of collected, more challenging problems. These count for 40% of your grade. Finally, you'll complete a final course exam, which counts for the remaining 40% of your grade.",Python
ec,1119,MongoDB Basics,"MongoDB Basics is designed for learners brand new to MongoDB. If you've heard about MongoDB and want to know more or are planning a MongoDB project and need to get a quick start, this is the course for you.<br /><br />In MongoDB Basics, you will learn the essentials of the MongoDB document model and explore the advantages of writing software using a database that accommodates the ways developers commonly think about and structure data in their applications. MongoDB stores data using a binary form of JSON (JavaScript Object Notation), enabling you to work with data in the same way you would work with JSON in your programming language of choice.<br /><br />You will also learn the MongoDB query language, including how to query arrays, objects, geospatial data and other hierarchical data structures stored within documents.<br /><br />Throughout the course, you will learn to use MongoDB Compass, a GUI client for interacting with MongoDB and Atlas, the MongoDB cloud service. You'll create your own Atlas account for free and gain experience deploying MongoDB clusters, importing data, and using Compass to explore a number of data sets provided to you. In the process, you'll get hands-on experience with a variety of query building and data modeling strategies that will prepare you to develop applications with MongoDB.",MongoDB
ec,1127,Mandarin Chinese Essentials,"Chinese is a critical language for all global organizations. Mandarin Chinese Essentials features a thorough basic Chinese virtual learning experience at your pace!<br /><br />Switching from Latin alphabet or other phonogram languages to Chinese can be intimidating and frustrating. This prerequisite course breaks down all basic characteristics of Chinese language, ensuring you have a solid foundation to be a competent speaker in a business environment.&nbsp;<br /><br />We will introduce one rule with practices and related dialogues through videos that include&nbsp;practical business&nbsp;conversations. <br /><br />We provide solid learning system that is essential for beginners to differentiate and construct sentences, and then use them in workplace and business scenarios.<br /><br />If you enroll in the verified track, you will be able to participate in the Webinar lectured by Dr. Estella Y. Chen, who will lead the&nbsp;discussion&nbsp;with&nbsp;a wide variety of&nbsp;popular&nbsp;topics&nbsp;to&nbsp;accompany&nbsp;you to the world of chinese business culture and trend.<br /><br />What's more, in the verified track, we'll give you three pronunciation lessons that will help you&nbsp;communicate more smoothly and effectively in&nbsp;a business environment. <br /><br />No previous knowledge needed. We start from the beginning! <br /><br />This course was developed with the assistance of Dr. Haohsiang Liao, Director of the Chinese Language Program at MIT.",Chinese
ec,1128,Mandarin Chinese Level 1,"Chinese is, without a doubt, the most spoken language on the planet. <br /><br />Learning Chinese will help your company or organization break into the biggest market on the planet. Being able to properly and correctly introduce yourself in Chinese will help you open the door to a whole new world.<br /><br />Mandarin Chinese Level 1&nbsp;will introduce you to the basic language skills you will need to eat, live, and get around in Mandarin speaking countries, building your confidence to communicate effectively with colleagues, clients and friends in Chinese.<br /><br />If you enroll in the verified track, you will be able to participate in the Webinar lectured by Dr. Estella Y. Chen, who will lead the discussion with a wide variety of popular topics to accompany you to the world of chinese business culture and trend.<br /><br />What's more, in the verified track, we'll give you three pronunciation lessons that will help you communicate more smoothly and effectively in a business environment.<br /><br />Since this is a language course, we recommend taking this course with a friend or group of friends. Practicing with others by speaking the language will help you learn it more effectively. <br /><br />Additionally, Mandarin is a tonal language, which means that in order to truly master it, you will need to say the words out loud! Join the community of over 900 million native Mandarin speakers and start learning today!",Chinese
ec,1129,Mandarin Chinese Level 2,"In this course, you will learn extensive vocabulary for describing people and objects, making comparisons, and stating your own perspectives by using complex and varied sentence structures.<br /><br />Learners will focus on tones and intonation with designed practices and learn to build dialogues in a business environment. After this Mandarin Chinese language course, you will be able to communicate in Mandarin speaking countries without difficulties.<br /><br />If you enroll in the verified track, you will be able to participate in the Webinar lectured by Dr. Estella Y. Chen, who will lead the discussion with a wide variety of popular topics to accompany you to the world of chinese business culture and trend.<br /><br />What's more, in the verified track, we'll give you three pronunciation lessons that will help you communicate more smoothly and effectively in a business environment.<br /><br />Supplementary tools or materials are recommended if you would like to learn written language and stroke orders of Chinese characters.",Chinese
ec,1130,Mandarin Chinese Level 3,"Drawing from the skills you developed in&nbsp;previous&nbsp;courses in this series, you will learn how to address yourself more properly in different business circumstances.<br /><br />In Mandarin Chinese Level 3, you will advance your Mandarin Chinese with extensive vocabulary and complex sentence structures based on dynamic business scenarios.<br /><br />You will not only learn to respond correctly but also to deliver your point of view and convey a clear idea in Mandarin Chinese.<br /><br />If you enroll in the verified track, you will be able to participate in the Webinar lectured by Dr. Estella Y. Chen, who will lead the discussion with a wide variety of popular topics to accompany you to the world of chinese business culture and trend.<br /><br />What's more, in the verified track, we'll give you three pronunciation lessons that will help you communicate more smoothly and effectively in a business environment.<br /><br />Previous knowledge of Mandarin Chinese is needed.</p>",Chinese
ec,1131,Mandarin Chinese for Business,"Take the next step in learning Mandarin Chinese and expand your language skills so you can effectively communicate in Chinese business.<br /><br />In this language training course, you will learn common phrases and scenarios of business and negotiation in Chinese speaking countries. You will also learn about Chinese business culture and etiquette and the needs of businessmen and women.<br /><br />If you enroll in the verified track, you will be able to participate in the Webinar lectured by Dr. Estella Y. Chen, who will lead the discussion with a wide variety of popular topics to accompany you to the world of chinese business culture and trend.<br /><br />What's more, in the verified track, we'll give you three pronunciation lessons that will help you communicate more smoothly and effectively in a business environment.<br /><br />This course was developed with the assistance of Dr. Haohsiang Liao, Director of the Chinese Language Program at MIT.<br /><br />Basic knowledge of Mandarin Chinese is required.",Chinese
ec,1138,Principles of Health Law and Regulatory Issues,"This course is part of the Certified Lifestyle Medicine Executive MicroMasters program which consists of 9 courses and a capstone exam. After completing the program, you can also apply to Doane University to complete your MBA online for approximately $10,500 (learn more about the program <a title=""Doane University MBA"" href=""https://www.doane.edu/lp/certified-lifestyle-medicine-executive.html?r_source=Web%20-%20CLME"" target=""_blank"" rel=""noopener noreferrer"">here</a>).<br />________________________________________________________________<br /><br />Executives in healthcare systems must have an understanding of healthcare legal and regulatory issues surrounding finance and risk as well as compliance within the law in order to navigate and change the system.<br /><br />This course is a survey course that covers a wide range of important issues in health law.<br /><br />This course is part of the Certified Lifestyle Medicine Executive&nbsp;MicroMasters program. For an introduction to lifestyle medicine, see the <a href=""https://www.edx.org/professional-certificate/doanex-lifestyle-medicine-competencies"">Lifestyle Medicine </a>Competencies Professional Certificate program.",Legal Industry Knowledge
ec,1141,Applying Leadership and Strategy Fundamentals in Healthcare,"This course is part of the Certified Lifestyle Medicine Executive MicroMasters program which consists of 9 courses and a capstone exam. After completing the program, you can also apply to Doane University to complete your MBA online for approximately $10,500 (learn more about the program <a title=""Doane University MBA"" href=""https://www.doane.edu/lp/certified-lifestyle-medicine-executive.html?r_source=Web%20-%20CLME"" target=""_blank"" rel=""noopener noreferrer"">here</a>).<br />________________________________________________________________<br /><br />Leaders must first recognize their own strengths and style before they can effectively lead change. Learners will have the opportunity to assess their personal style of leadership by learning more about their strengths and areas of improvement based on leadership theories and style discussed within the course. <br /><br />Executive leaders promote individual employee growth, while securing organizational outcomes. Learners will review theories related to coaching, mentoring, and motivation. Team development will be explored through the topics of facilitation and collaboration.<br /><br />This course is part of the Certified Lifestyle Medicine Executive&nbsp;MicroMasters program. For an introduction to lifestyle medicine, see the <a href=""https://www.edx.org/professional-certificate/doanex-lifestyle-medicine-competencies"">Lifestyle Medicine</a> Competencies Professional Certificate program.",Leadership
