,,title,description,skill
fl,767,Understanding Information and Technology Today,"Learn what to use computers for and when to switch them off and think.When we talk about technology and IS (information systems) we tend to focus on computers.  Instead, in this course we examine the ‘big picture’ of technology, in order to gain a better understanding of what computers can do for us and when we should switch off our computers, smartphones, tablets and wearables.  We cover some of the fundamental concepts of technology and IS but the aim is not to provide an in-depth understanding of specific applications, but to help you develop a context for the technologies you encounter and to help you understand the changes in the technology landscape.You don’t need any past experience of this topic to take this course. You might find this course particularly useful if you’re background isn’t in technology but you now find yourself using technology regularly.",Information Technology Industry Knowledge
fl,785,Introduction to Psychology: The Psychology of Learning,"Understand the different ways we learnHow do people learn different behaviours? How does biology affect our ability to learn new things?On this course you will answer these questions and others, exploring the psychology of learning. You will consider the difference between learned and instinctive behaviours and approaches to how we learn - for instance, you’ve probably heard of Pavlov and his dog, an example of classical conditioning. But you’ll also learn about operant conditioning (learning behaviours based on positive or negative consequences), and observational learning (watching other people and imitating their behaviour).This introductory course is for anyone interested in psychology - you don’t need any past experience.It might be of particular use to learners who have already completed a Bachelor degree in other disciplines who are interested in expanding their science and research skills.Complete this course, then the programThis course is part of the Introduction to Psychology Program, based on the first unit of Monash University’s fully online Graduate Diploma of Psychology (GDP).Learners who successfully complete the seven courses in the Program and who are accepted into the Graduate Diploma of Psychology will receive one unit of academic credit.",Psychology
fl,792,German at Work Intermediate 1: Deutsch am Arbeitsplatz,"German is the most widely spoken native language in Europe, and German-speaking countries benefit from strong economics and low unemployment.This course will help you consolidate your German communication skills for the workplace. It follows German at Work Post-Beginners 2: Deutsch am Arbeitsplatz.You’ll learn to talk about your career and write a CV, discuss employment and the right job for you, as well as find out more about education in Germany.You’ll develop your linguistic competence (at level B1) and deepen your cultural understanding.This course is for learners who already have an intermediate level of German.This course follows German at Work Post-Beginners 2: Deutsch am Arbeitsplatz.",German
fl,794,Basic English 2: Pre-Intermediate,"Develop your English for a range of everyday situationsOn this course you will build your English skills. You will develop your use of English in a wider range of everyday situations and grow your listening ability.You will develop your English skills by hearing people speak in a range of situations, and you will test your knowledge by writing short responses to simple discussion questions.By the end of the course you will feel more confident in your ability to speak and understand basic English.If you would prefer an easier course, please try Basic English: Elementary.This course is designed for refugees, displaced people and the communities supporting them in the MENA (Middle East and Northern Africa) region who want to learn English for studying and for work. It has been created as part of the PADILEIA project.However, it will also be of interest to anyone looking to develop their skills in basic English.We recommend learners have a minimum of CEFR (Common European Framework of Reference for Languages) A2 to get the most from this course.Supported by UK aid - Strategic Partnerships for Higher Education, Innovation and Reform",English
fl,798,Leaders: Their Role and Impact on Business,"Understand what makes a leader and the effects of leadership on a workplaceDefining leadership can be difficult. Leadership is a multidimensional construct that many theorists have dedicated their time to defining.On this course, you will explore some of these theories - learning what leadership is and how good and bad leadership can affect a business and its employees. You will consider different leadership models to help clarify the universal components of leadership and how these components differ to management.This course is for people looking for an enhanced understanding of leadership, its role and effects.",Leadership
fl,833,Digital Skills: Digital Marketing,"Learn to use digital marketing to grow your career or businessDigital marketing can be a crucial tool to grow a business. On this course you will explore what digital marketing is, why it is important and look at some digital marketing strategies including display advertising, pay per click advertising, search engine optimisation and email marketing. Finally, we will discuss the importance of balancing and integrating different digital marketing strategies and how companies target customers.This course is for anyone with an interest in digital marketing who is seeking to develop their entrepreneurial skills, preparing to enter the workplace or looking to change careers. No prior experience or qualifications required.Interested in growing your digital skills more widely? Discover more Digital Skills courses from Accenture.",Digital Marketing
fl,836,Irish 102: An Introduction to Irish Language and Culture,"Develop your knowledge of the basics of the Irish languageIreland is home to one of the oldest living languages in Europe.This course follows the course Irish 101: An Introduction to Irish Language and Culture.On this course, you’ll improve your understanding of basic spoken words, phrases and dialogues in Irish.You’ll learn how to discuss the weather, tell the time and expand your language awareness.You’ll explore the vibrant culture of Ireland, by learning about Irish place-names, the Irish calendar, traditional festivals and the fusion of art, language and culture.Bígí linn – join us!This course is aimed at anyone interested in Irish language and culture.",Irish
fl,852,Spanish for Beginners 1: Meeting and Greeting,"This free online course is the first of six in the Spanish for Beginners program.  It will introduce you to the basic language, so that you are able to:  greet people and introduce yourself and others;  talk about where you live and where you come from;  talk about what you do;  talk about the languages you speak;  ask for clarification or repetition when you don’t understand.Start to speak, listen, read and write in SpanishDuring the four weeks of the course, you will learn some of the vocabulary and phrases you need to help you interact with people at a basic level.You will start to develop the four language skills of speaking, listening, reading and writing through a range of activities that introduce the language in authentic settings, and the audio and video resources will show you the language in action.There are some activities when you will also practise your speaking skills, as it is important that you start speaking as soon as possible!You will also learn some essential Spanish grammar, including some basic verbs.  Finally, you will get some tips and advice on how to develop your study skills, so that you become a successful language learner.Take your Spanish learning offline by purchasing two hours of downloadable audio files and transcripts made by the course creators at The Open University. These MP3s are a great way to practise your Spanish listening and speaking wherever you are. They cover examples and exercises in the same topics as the course.This course is aimed at people with no prior knowledge of Spanish who want to learn the basic language and find out about the Spanish-speaking world. It will be taught through English.",Spanish
fl,858,Advanced Data Mining with Weka,"Extend your repertoire of data mining scenarios and techniquesThis course will bring you to the wizard level of skill in data mining, following on from Data Mining with Weka and More Data Mining with Weka, by showing how to use popular packages that extend Weka’s functionality. You’ll learn about forecasting time series and mining data streams. You’ll connect up the popular R statistical package and learn how to use its extensive visualisation and preprocessing functions from Weka. You’ll script Weka in Python – all from within the friendly Weka interface. And you’ll learn how to distribute data mining jobs over several computers using Apache SPARK.This course is aimed at anyone who deals in data. You should have completed Data Mining with Weka and More Data Mining with Weka – or be an experienced Weka user. Although the course includes some scripting with Python, you need no prior knowledge of the language. You will have to install and configure some software components; we provide full instructions.Before the course starts, download the free Weka software. It runs on any computer, under Windows, Linux, or Mac. It has been downloaded millions of times and is being used all around the world.(Note: Depending on your computer and system version, you may need admin access to install Weka.)",WEKA
fl,876,Leadership Theory: The Basics,"Learn the basics of leadership theoryOn this leadership course, you will be introduced to the theoretical underpinnings of leadership, different styles of leadership and their respective strengths and weaknesses.You will have the opportunity to learn the differences between management and leadership and will investigate in detail the ethical issues that surround the issue of leadership.This course is for experienced professionals looking to understand how a modern business succeeds through leadership, culture, decision making and change management.",Leadership
fl,889,The Digital Economy: Effective Supply Chain Management,"Create value with your supply chainGoods and services reach end users through increasingly intricate channels, involving people and processes all over the world, supported by advancing technology.Understanding the key relationships in these supply chains can help you cut costs, boost performance and create more value for customers.This online course will equip you with a critical appreciation of the way supply chains work, and how to make them work better.Whether you are a sole trader, in a small to medium-sized organisation, or work for a large firm, you’ll find out how the supply chain is changing in the digital era.This course is intended for anyone who wants to learn about the effect the digital era is having on supply chains, customers and other stakeholders. No previous experience of studying supply chain management is required, but some basic knowledge of how businesses work would be beneficial.Find further information about OU registration, the assessment module and MBA in the entry requirements.",Supply Chain Management
fl,891,Spanish for Beginners 2: People and Places,"This free online course is the second of six in the Spanish for Beginners program.  It will introduce you to the language that you need to:  describe people, both physically and in terms of their personality;  talk about what people wear (clothes, accessories and colours);  talk about your family;  ask for people’s contact details (address, telephone number, e-mail);  describe your home and the furniture in it;  talk about what you want when looking for accommodation.Talk about people and places in SpanishDuring the four weeks of the course, you will learn the vocabulary and phrases you need to talk about people and places, and the present tense of some of the basic verbs, such as se/estar (to be), tener (to have) and querer (to want), and the expression ‘hay’ (there is/there are) to describe places.You will also learn how to ask questions in Spanish.  You will continue to develop your speaking, listening, reading and writing skills, through the activities, the audio and the video resources.You will find tips and advice on how to develop our study skills, and some cultural information about people and places in the Spanish speaking world.Take your Spanish learning offline by purchasing two hours of downloadable audio files and transcripts made by the course creators at The Open University. These MP3s are a great way to practise your Spanish listening and speaking wherever you are. They cover examples and exercises in the same topics as the course.This course is aimed at people with little prior knowledge of Spanish who want to learn the basic language and find out about the Spanish-speaking world. The course assumes that you have already studied the first course in the Spanish for Beginners program. This course is taught through English.",Spanish
fl,892,Spanish for Beginners 4: Leisure Time,"This free online course is the fourth of six in the Spanish for Beginners program.  It will introduce you to the language that you need to:  talk about your hobbies and leisure time, such as sports and music;  talk about healthy living;  talk about what you like and dislike;  talk about what you prefer;  give reasons, express your opinion, and agree and disagree with others.Learn Spanish to talk about your hobbies and interestsDuring the four weeks of the course, you will learn vocabulary and expressions to talk about your leisure time, such as what you do in your free time at home, like reading or watching TV, or outdoors.You will learn vocabulary to talk about sports and healthy lifestyles, about musical instruments, and about historical or modern buildings that you might see in your travels.You will also learn how to talk about what you like, and about what you are not so keen on, using the verb gustar (to like) and preferir (to prefer).By now, you will be halfway through the Spanish for Beginners program, and you will be growing in confidence.  You will be coming across longer texts in Spanish, and will have to read some of them for gist, so you understand what they are about even if you don’t understand all the words.You will learn about Ecuador, and its capital, Quito, and about Latin dance too.This course is aimed at people with little prior knowledge of Spanish, who want to learn the basic language and find out about the Spanish-speaking world.  The course assumes that you have already studied the previous three courses in the Spanish for Beginners program.  This course is taught through English.",Spanish
fl,893,Spanish for Beginners 6: Out and About,"This free online course is the last of six in the Spanish for Beginners program.  It will introduce you to language that you need to:  talk about where places are;  ask for directions;  shop for clothes;  order food and drinks.Learn how to go out, shop, eat and drink in SpanishDuring the four weeks of the course, you will learn some phrases you’ll need if you have to ask for directions, as well as a range of vocabulary related to clothes and food, so you can enjoy going shopping next time you visit a Spanish-speaking country.You will find out about tapas, pinchos and raciones, and be able to make sense of a Spanish menu, and will learn about the beautiful city of Valencia in Spain.  You will also learn to use the imperative to give directions.By now, as we reach the end of the Spanish for Beginners program, you should be fairly confident in using basic Spanish to talk about yourself and about everyday and familiar situations.In this course, you will also find some advice about what you can do next to take your Spanish further.This course is aimed at people with little prior knowledge of Spanish, who want to learn the basic language and find out about the Spanish-speaking world.  The course assumes that you have already studied the previous five courses in the Spanish for Beginners program.  This course is taught through English.",Spanish
fl,904,Studying in Italian - Language and Literature:  a MOVE-ME Project Course,"Study Language and Literature in ItalianEach year thousands of students travel across Europe to study in a foreign language like Italian. This can be daunting, even for those who are fluent.This online course, developed within the MOVE-ME project  by UniStraSi, NUI Galway and The  Open University,  will help, guiding you through the peculiarities of academic discourse in Italian, and enabling you to understand and produce written and aural academic texts.1 ECTS credit is awarded by completing the course, taking the final test and obtaining the Certificate of Achievement.This course is aimed at university students taking part in student mobility programmes in Europe and international students attending courses in Italy. A minimum B1 knowledge of Italian is required.",Italian
fl,907,Advanced Machine Learning,"Discover and apply advanced statistical machine learning techniquesThis online course explores advanced statistical machine learning.You will discover where machine learning techniques are used in the data science project workflow. You will then look in detail at supervised learning statistical modeling algorithms for classification and regression problems, examining how these algorithms are related, and how models generated by them can be tuned and evaluated.You will also look at feature engineering and how to analyse sufficiency of data.This is an advanced course and some experience with machine learning, data science or statistical modeling is expected. Links will be provided to basic resources about assumed knowledge.Sections of the course make use of advanced mathematics, including statistics, linear algebra, calculus and information theory. If you have prior knowledge of these areas, particularly the first two, you will obtain additional insights into the methods used. If you do not have this prior knowledge, you will still be able to achieve the learning outcomes of the course.The course uses R. If you have not programmed with R before, you should consider taking a quick introductory course, such as Try R.",Machine Learning
fl,920,Basic English 1: Elementary,"Learn English for use in everyday situationsThis free online course will help you learn basic English skills. It will give you confidence in everyday situations and help you improve your listening skills.Use your computer or smartphone to hear people talking in English in a number of different situations and test your understanding with quizzes.You will have the chance to chat with other learners in English and to write short responses to some simple discussion questions.After taking this course you can progress to Basic English: Pre-Intermediate.This course is designed for refugees, displaced people and the communities supporting them in the MENA (Middle East and Northern Africa) region who want to learn English for studying and for work. It has been created as part of the PADILEIA project.However, it will also be of interest to anyone looking to develop their skills in basic English.We recommend learners have a minimum of CEFR (Common European Framework of Reference for Languages) A1 to get the most from this course.Supported by UK aid - Strategic Partnerships for Higher Education, Innovation and Reform",English
fl,922,German at Work Intermediate 2: Deutsch am Arbeitsplatz,"German is the most widely spoken native language in Europe, and German-speaking countries benefit from strong economics and low unemployment.This course will help you consolidate your German communication skills for the workplace. It follows German at Work Intermediate 1: Deutsch am Arbeitsplatz.You’ll learn how to discuss current employment trends, preconceptions and stereotypes, vocational training in Germany, and job applications.You’ll develop your linguistic competence (at level B1) and deepen your cultural understanding.This course is for learners who already have an intermediate level of German.This course follows German at Work Intermediate 1: Deutsch am Arbeitsplatz.",German
ss,0,Fundamentals of Lean and Six Sigma and their Applications,"Six Sigma is a data-driven improvement strategy that views all activities within an organization as processes. Process inputs can be controlled and adjusted to effect significant improvements in process outputs. Six Sigma uses a rigorous and systematic methodology known as DMAIC (define, measure, analyze, improve, and control) and a number of qualitative and quantitative tools. Its goal is to drive process, product, and service improvements for reducing variation and defects. Lean is also an improvement methodology, but with a different focus. It aims to enhance process flow, reduce cycle time, and eliminate waste.   Though Lean and Six Sigma originated in different places and under different circumstances, they are now largely seen as complementary methodologies. Organizations across various industries are striving to become faster and more responsive to customers, achieve near-perfect quality, and operate using world-class cost structures. You need both Lean and Six Sigma to achieve these goals. This course introduces Six Sigma and Lean methodologies and looks at the relationship between them. It also explores relationships among business systems and processes using some practical examples of Lean Six Sigma applications in both manufacturing and service industries. This course is aligned with the ASQ Certified Six Sigma Black Belt certification exam and is designed to assist learners as part of their exam preparation. It builds on foundational knowledge that is taught in SkillSoft’s ASQ-aligned Green Belt curriculum.",Six Sigma
ss,1,"Six Sigma Project Selection, Roles, and Responsibilities","Deployment of Six Sigma, Lean, or another continuous improvement methodology demands major investments of time, effort, and money on behalf of an organization. Organizations need to exercise due diligence to determine if Six Sigma or Lean is the appropriate methodology to employ, or perhaps a less demanding quality and process improvement approach is better suited to meet their needs. Having decided on the methodology, improvement teams need to determine screening criteria for the selection of most appropriate improvement projects. Success of these projects largely depends upon the contribution of a variety of Six Sigma stakeholders. As a key Six Sigma stakeholder, Black Belts often lead improvement teams and their skills and qualifications are critical to teams' ability to deliver the expected results.  This course deals with the key considerations around the selection of Six Sigma, Lean, and continuous improvement projects. It also explores roles and responsibilities of key stakeholders and qualifications needed for Black Belts for leading Six Sigma teams. This course is aligned with the ASQ Certified Six Sigma Black Belt certification exam and is designed to assist learners as part of their exam preparation. It builds on foundational knowledge that is taught in SkillSoft's ASQ-aligned Green Belt curriculum.",Six Sigma
ss,2,Six Sigma Strategic Planning and Deployment,"Strategic planning of Six Sigma projects and Lean initiatives plays a critical role in their success in an organization deploying them. A number of strategic analysis and planning tools, such as Hoshin Kanri, feasibility studies, SWOT and PEST analysis, can be used in support of strategic deployment of improvement projects and to enhance their value and effectiveness.   An organization's culture and its inherent structure, lack of resources, and top leadership support sometimes create organizational roadblocks that may result in deployment failures. Six Sigma Black Belts should be able to identify these roadblocks and deal with them effectively. Six Sigma deployment is a revolutionary strategy and may result in significant organizational changes. Black Belts need to proactively anticipate human responses, overcome them, and lead the organizational change.  The course discusses the importance of strategic planning and deployment of Six Sigma projects and Lean initiatives and some of the key tools used for this purpose. This course also explores organizational roadblocks and ways to manage them effectively. In addition, the course deals with changes caused by Six Sigma deployment, resistance to it, and strategies Black Belts can apply to manage change. This course is aligned with the ASQ Certified Six Sigma Black Belt certification exam and is designed to assist learners as part of their exam preparation. It builds on foundational knowledge that is taught in SkillSoft's ASQ-aligned Green Belt curriculum.",Six Sigma
