,,title,description,skill
cg,5,Energy Industry Fundamentals Certificate,"The Energy Industry Fundamentals course, for which the credential is based, takes a comprehensive look at the energy industry, including nuclear, natural gas, and renewable. Instructor guides and student materials are provided as part of the program, focusing on experiential learning techniques with a comprehensive online assessment at the end of the course. Students will be required to pass the assessment to receive the certificate.
Since CEWD is a coalition made up of energy companies, this credential is being created by the industry for the industry. This ensures that students are learning the right material that will help them succeed at their jobs.
Energy Industry Fundamentals is divided into modules. For those who want to offer the opportunity for their students to earn the credentials, all modules must be completed. This may not be the case in all situations, so schools or other training organizations can just use specific modules to fill in what they are already doing.",Energy Industry
cg,6,Insurance Studies Certificate,"The Certificate of Completion (CCL) in Insurance Studies program is designed to provide knowledge and skills training for various entry-level positions in the insurance industry. The courses include an introduction to the insurance industry, in addition to principles of property, liability, personal, and commercial insurance.",Insurance Industry Knowledge
cg,10,BOC Level I Training Certificate of Completion,"Level I classes support the BOC operator skill standard by devoting significant content to the topics of HVAC controls, common opportunities for operational improvements, and building scoping for energy efficiency. The Level I course series provides building operators with knowledge and skill enhancement in the key activities associated with energy efficient building operations. 1001-1006 are core classes, complemented by one of the supplemental classes which are selected by area program administrators to enhance the BOC training experience to specific regions throughout the country.",HVAC
cg,11,Official (ISC)² CISSP Training,"Our training helps you fully prepare for this cybersecurity certification. You will:

   - Review, refresh and expand your information security knowledge (including information security concepts and industry best practices).
   - Identify areas you need to study for the CISSP exam.
   - You can expect an in-depth review of the eight domains of the CISSP CBK - including discussion of industry best practices and timely security concepts.

(ISC)² authorized instructors lead all our training. You're learning from CISSP-certified industry experts who understand you. They are CISSPs themselves. They know how to make the content highly relatable. And they go through a rigorous process to teach to our CBK.

Plus, we use proven adult learning techniques to reinforce topics. This approach increases how much knowledge you retain. Our techniques are highly interactive. They focus on real-world learning activities and scenarios, so you get the most out of training.",Cybersecurity Strategy
cg,12,NSF Certificate in Food Safety Programs,"NSF International, NSF Training & Education Services is pleased to offer the NSF Certificate in Food Safety Programs. Participants taking one or all of the ANSI-accredited NSF courses included in this Certificate Program can have confidence in the quality of the program's administration, management, analysis, design, development and evaluation etc. This four course Certificate Program is designed to provide learners with practical knowledge that can be immediately implemented to meet food safety
requirements and standards.",Food Safety
cg,13,Certified Food Safety Manager Training,Certified Managers have a responsibility to share their food safety knowledge with the other food workers with whom they work. Many of the same training providers who develop training for managers have programs for food handlers. National Registry can help certified managers obtain those other training tools.,Food Safety
cg,42,Professional Development Certificate in SQL Server Business Intelligence Coursework,"An 11-week in-depth program designed to provide a comprehensive introduction to the Microsoft Business Intelligence platform using Microsoft SQL Server. The program focuses on teaching data professionals how to use SQL Server 2012 product features and tools to build business intelligence solutions. These features include analysis services with real-time analytics, integration services, data mining, reporting services, Power View and PowerPivot, Key Performance Indicators, cube and dimensions development, proactive caching, SQL Server Management Studio, Business Intelligence Development Studio, and integration with the Microsoft Office system. Students learn advanced product knowledge and skills needed to support business users.

The Institute offers a session in the fall, winter, and spring quarters. Classes meet one evening per week. The option to take the program strictly online is also available.",Microsoft SQL
cg,44,.Net Web Developer Program,"A 10-week comprehensive program covering web development with Microsoft .NET technologies. Topics include .NET 4 framework; Common Language Runtime (CLR); C# language; Visual Studio 2015; ASP.NET; Web and Windows Forms; ADO.NET, LINQ, and Entity Framework; assemblies; memory management; Global Assembly Cache (GAC); jQuery; SOAP-based Web services; WPF; WCF; .NET security; XML support; and, threading models.

The Institute offers one section of the program each quarter. Classes meet on Tuesday and Thursday evenings and in the morning on approximately half of the Saturdays during the program. The option to take the program entirely online is also available.",.NET
cg,47,Graduate Certificate in Cybersecurity - Critical Infrastructure,"The Cybersecurity area of study blends both information technology (IT) and operational technology (OT) and focuses specifically on securing critical infrastructures in sectors such as energy, water, gas and transportation.  The program prepares students, especially those currently in the utility industry, to advance professionally in the cybersecurity field and prepares IT professionals to transition into the utility industry.",Infrastructure Security Fundamentals
cg,49,Welding & Fabrication Industry Certification Program,"The Monroe Community College Career Welding & Fabrication Program features training for MIG, TIG, Flux Core and Stick welding processes. On-site AWS Qualification training and testing is conducted to validate the students' skill level. A mininum of six tests must be successfully completed and students have the opportunity to take as many more as time permits. The program also provides resume writing assistance, employer research techniques, and mock job interviews. To date, our graduates have been hired by over 110 different Rochester area employers.",MIG (PULSE) Welding
cg,50,Welding & Fabrication Industry Certification Program - Additional Welding Programs,"The Monroe Community College Career Welding & Fabrication Program features training for MIG, TIG, Flux Core and Stick welding processes. On-site AWS Qualification training and testing is conducted to validate the students' skill level. A mininum of six tests must be successfully completed and students have the opportunity to take as many more as time permits. The program also provides resume writing assistance, employer research techniques, and mock job interviews. To date, our graduates have been hired by over 110 different Rochester area employers.",MIG (PULSE) Welding
cg,51,Welding & Fabrication Industry Certification Program - STICK WELDING FOR PIPING & STRUCTURAL TUBE,"This fast-paced course is designed to provide the skills necessary to gain professional level qualifications for pipe and structural tube welding. Filler metals and piping materials for this course are included in the cost. Safety gear, welding hood and standard fitting tools are required and not provided. A complete supply list will be reviewed during the preregistration meeting. All candidates will meet with the instructor for a pre-registration interview to review and verify sufficient basic skills to successfully complete the course.",Pipe Welding
cg,52,Bachelor's Degree in Cybersecurity Curriculum,"The BS-Cybersecurity program is an inclusive education in the theory and application of technical and non-technical security skills. The program covers an array of abilities required by the quickly evolving cybersecurity industry. These skills include applying protection, detection, and response technologies and procedures to identify threats, vulnerabilities, exploits, and controls in various cyber environments. Emphasis is placed on identifying, analyzing, mitigating and communicating risks to cyber systems using various tools, techniques, and technologies.",Cybersecurity Strategy
cg,53,Enhanced Operator Certificate 16 - Week Training Program - Phase 1 Milestones,"The Enhanced Operator Certificate is a short-term Corporate College industry credential consisting of 14 credit hours of coursework. Upon successful completion of this program, students will obtain the Enhanced Operator Certificate (short-term college credential) equivalent to 14 credit hours of college credit, and will have the option of obtaining Lean Six Sigma Yellow Belt Certification (at an additional cost). NOTE: For those students who wish to continue their education in pursuit of an associate degree, the Enhanced Operator Certificate will count towards the Manufacturing Engineering Technology Associate in Applied Science program.",Six Sigma
cg,54,Enhanced Operator Certificate 16 - Week Training Program - Phase 2 Milestones,"The Enhanced Operator Certificate is a short-term Corporate College industry credential consisting of 14 credit hours of coursework. Upon successful completion of this program, students will obtain the Enhanced Operator Certificate (short-term college credential) equivalent to 14 credit hours of college credit, and will have the option of obtaining Lean Six Sigma Yellow Belt Certification (at an additional cost). NOTE: For those students who wish to continue their education in pursuit of an associate degree, the Enhanced Operator Certificate will count towards the Manufacturing Engineering Technology Associate in Applied Science program.",Six Sigma
cg,58,Certified Production Technician Courses,"MSSC delivers its CPT Courses through well-established training organizations.  There are three types of Courses to meet various individual and training needs. These Courses are designed (a) to align with MSSC Standards and (b) to help individuals enhance their core knowledge and skills for production work from entry-level to front-line supervisory level.

These Courses are built upon MSSC's e-learning which includes modular courses for: Safety, Quality Practices & Measurement, Manufacturing Production & Processes, Maintenance Awareness, and Green Production. The online, computer-based simulation training covers the basic and technical skills while providing students and workers with the knowledge and skills needed to prepare them for an advanced, high-performance manufacturing environment.",Manufacturing Industry Knowledge
cg,59,Certified Logistics Technician Courses,"To enhance the competency of the supply chain logistics workforce, MSSC offers two logistics Courses aligned with its standards. These Courses can be given in a blended learning environment using both instructor led and e-learning methodologies or as fully online courses with an online instructor. Students have the ability to enhance their knowledge and computer skills through the e-learning material. MSSC offers courses only to educational institutions and companies that have MSSC-Authorized Instructor in CLT. 

MSSC Courses were developed in strict adherence to the industry-recognized, nationally validated standards upon which the Certified Logistics Technician (CLT) is based. These Courses, delivered by The Quality Group have a proven track record of success in teaching the knowledge and skills identified in the national standards. The success rates for students taking MSSC Courses are 27-points higher than those who do not (78% vs. 51%, respectively). MSSC Courses are highly interactive and utilize state-of-the-art, computer-based e-learning technologies and are delivered by MSSC-Authorized Instructors. MSSC does not authorize, review or endorse any other courses or curricula. MSSC does not require that individuals take MSSC Courses or any other MSSC-related courses before taking an MSSC Assessment.",Logistics
cg,61,Certificate in Cyber Security Fundamentals Coursework,"Explain the landscape, key terms and concepts related to the many layers of information systems security. Implementation policy is also explored.",Cybersecurity Strategy
cg,62,Bachelor of Science in Cyber Security,"The cyber security major prepares individuals for a career as a security professional. This curriculum prepares students for success in IT Security, Cyber Security, Information Assurance, and Information Security Systems Security. It is designed for students with some background in computers. This major requires a minimum of 45 credits.

This major contains courses in both Information Technology and Computer Science.",Cybersecurity Strategy
cg,63,Certificate for Apartment Maintenance Technicians Courses,"The non-technical Soft Skills course consists of online learning, including practice scenarios.  Five technical courses consist of hands-on classroom training followed by online practice scenarios.

Technical Courses

    Electrical Maintenance and Repair
    Plumbing Maintenance and Repair
    Heating, Ventilation and Air Conditioning (HVAC) Maintenance and Repair
    Appliance Maintenance and Repair
    Interior and Exterior Maintenance and Repair
Non-Technical Online Course Modules:

Welcome to the Industry
Customer Service
Teamwork
Time & Project Management
Money Matters
Documentation & Paperwork
Maintenance & Emergencies
Safety First
Compliance
Enhanced with FranklinCovey Insights on Demand video-based online courses
Programs may be taken as standalone seminars or in full to earn the industry credential.",Apartment Maintenance
cg,67,Connecting Learning Theories to Your Teaching Strategies,"Participants in this two-week workshop will learn about several different theories of learning and how teaching strategies based on those theories can promote learning.

Competency: Select teaching strategies based on learning theories.",Teaching
cg,71,Graphic Design Certificate Program,"The SMU Graphic Design Certificate program is offered in a cohort format. A cohort is structured so that students progress through the program together, guided by expert instructors. Courses build upon one another with assignments and lessons, allowing you to hone your design skills in between class sessions. The certificate program culminates in a Capstone Course, in which you'll create your final, portfolio-bound design project, with the guidance of your instructor.",Graphic Design
cg,72,Web Design Certificate Program,"During the certificate program, you will be working on a real-world website project and will require use of the Adobe Creative Cloud software. 
Complete these 10 courses to earn your certificate: Introduction to Web Design, HTML5 and CSS3 (Level 1), Photoshop Essentials, HTML5 and CSS3 (Level 2), Illustrator Essentials, Web Graphics and Interface Design, Javascript and JQuery, Fundamentals of User Interface Design and User Experience, Responsive Design, and Capstone.",HTML5
cg,79,Stem Cell Technologies Certificate,The Stem Cell Technologies Certificate is a two-semester evening program for individuals with a Bachelor of Science degree or an Associate of Applied Science (or equivalent) in the biological sciences who want to work in stem cell technologies and regenerative medicine.,Stem Cell Biology
cg,83,Bachelor of Science in Business Administration with a Major in Management - Project Management Concentration Coursework,A Bachelor of Science in Business Administration with Major in Management - Project Management Track requires the following courses.,Project Management
cg,84,Bachelor of Science in Business Administration with a Major in Management - Human Resource Management Track Coursework,A Bachelor of Science in Business Administration with Major in Management - Human Resource Management Track requires the following courses.,Human Resource Management
cg,85,Bachelor of Science in Business Administration with a Major in Management - Business Analytics Career Track Coursework,A Bachelor of Science in Business Administration with Major in Management - Business Analytics Career Track requires the following courses.,Business Analysis
cg,93,Bachelor of Arts with a Major in English - Literature Concentration Coursework,A Bachelor of Arts with a Major in English with a Literature Concentration requires the following courses.,English
cg,94,Bachelor of Arts with a Major in English - Creative Writing Concentration Coursework,A Bachelor of Arts with a Major in English with a Creative Writing Concentration requires the following courses.,English
cg,95,Bachelor of Science with a Major in Accounting Coursework,A Bachelor of Science with a Major in Accounting requires the following courses,Accounting
cg,96,Bachelor of Arts in Sociology Coursework,A Bachelor of Arts in Sociology requires the following courses,Sociology
cg,98,Bachelor of Science in Sport Management Coursework,A Bachelor of Science in Sport and Event Management requires the following courses,Event Management
cg,108,Bachelor of Science with a Major in Biochemistry Coursework,A Bachelor of Science in Biochemistry requires the following courses.,Biochemistry
cg,110,Bachelor of Science with a Major in Chemistry Coursework,A Bachelor of Science in Chemistry requires the following courses.,Chemistry
cg,111,Bachelor of Arts with a Major in Chemistry Coursework,A Bachelor of Arts in Chemistry requires the following courses.,Chemistry
cg,115,Bachelor of Science with a Major in Biology Coursework,A Bachelor of Science in Biology requires the following courses.,Biology
cg,116,Bachelor of Arts with a Major in Biology Coursework,A Bachelor of Arts in Biology requires the following courses.,Biology
cg,117,Bachelor of Arts with a Major in Biology with a Teacher Licensure Coursework,A Bachelor of Arts in Biology with a Teacher Licensure requires the following courses.,Biology
cg,137,Bachelor of Arts with a Major in Journalism Coursework,A Bachelor of Arts with a Major in Journalism requires the following courses.,Journalism
cg,139,Bachelor of Science in Business Administration with a Major in International Business-Dual Degree,A Bachelor of Science in Business Administration with Major in International Business-Dual Degree requires the following courses.,Business Administration
cg,140,Bachelor of Science in Business Administration with a Major in International Business,A Bachelor of Science in Business Administration with Major in International Business requires the following courses.,Business Administration
cg,169,Bachelor of Science in Business Administration with Major in Marketing Coursework,A Bachelor of Science in Business Administration with Major in Marketing requires the following courses.,Business Administration
cg,178,Precision Machining Technology Associate of Applied Science Courses,"If you're into computers and tools, this will be the right fit for you. You'll cut, grind, shear and shape your way into a machining career.",Machining
cg,182,The Course in Effective Teaching Practices,"ACUE's Course in Effective Teaching Practices prepares college educators to implement all of the essential practices shown to improve student outcomes. The Course includes 25 one-hour online modules across five comprehensive units of study. Consisting of over 180 instructional videos, the Course showcases exemplary teaching on campuses nationwide and features interviews with leading experts in college instruction.

ACUE has achieved QM certification in a nationally recognized quality assurance review.",Teaching
cg,186,Physical Therapist Assistant Studies Coursework,"To complete the Physical Therapist Assistant program at the University of Saint Francis, you must complete the 71 credits indicated in curriculum plan. You are required to maintain a GPA of 2.0 or higher on a 4.0 scale to be eligible to graduate.",Therapist Assistance
cg,193,Administration Essentials for New Admins and Certification (ADM 201C),"If you are an existing Salesforce Administrator who wants to learn the techniques and best practices to ensure the success of your deployment and sit for the Salesforce Administrator Certification examination, then this is the class for you",Salesforce Administration
cg,195,Certification Preparation for Service Cloud Consultant (CRT-261),"Are you ready to take the next step in your career by becoming a Salesforce
Certified Sales Cloud Consultant? Instructors will present scenarios that
will help reinforce your knowledge of Sales Cloud functionality by thinking
through requirements design considerations. The course provides an
overview of the exam objectives to help you focus your efforts to prepare for
the Salesforce Sales Cloud Consultant Certification exam.",Salesforce Sales Cloud
cg,196,Service Cloud Administration (ADM-261),"Service Cloud Administration is a must for experienced administrators who
need to configure and maintain the Service Cloud for their organizations.
Using real-world scenarios, this course will teach administrators how to
configure Salesforce Knowledge, set up service contracts with milestones
and entitlements, create the Console for Service application, configure the
SoftPhone using Open CTI, and set up Live Agent. This course will also teach
administrators how to configure a Customer Community.",Salesforce Service Cloud
cg,197,Certification Preparation for Sales Cloud Consultant (CRT-251),"Are you ready to take the next step in your career by becoming a Salesforce
Certified Sales Cloud Consultant? Instructors will present scenarios that
will help reinforce your knowledge of Sales Cloud functionality by thinking
through requirements design considerations. The course provides an
overview of the exam objectives to help you focus your efforts to prepare for
the Salesforce Sales Cloud Consultant Certification exam.",Salesforce Sales Cloud
cg,198,Sales Cloud Administration  (ADM-251),"Sales Cloud Administration: Products, Quotes, Orders, and Collaborative Forecasts is a must for all administrators who need to configure and maintain these features for their organizations. Using realworld scenarios, this course will teach administrators how to set up products, price books, quotes, and orders to streamline their processes. This course will also teach administrators how to configure Collaborative Forecasts to generate accurate forecasts and track quota attainment.",Salesforce Sales Cloud
cg,201,Advanced Apex Specialist Superbadge,Demonstrate your advanced Apex and Visualforce programming skills and implement complex business logic.,Apex Code
cg,202,Apex Specialist Superbadge,Use integration and business logic to push your Apex coding skills to the limit.,Apex Code
cg,214,Certification Preparation for Advanced Administrator (CRT-211),"Are you ready to be recognized for your mastery of Salesforce administration
by becoming a Salesforce Certified Advanced Administrator? By covering
the details around the exam objectives, this course will help hone your
knowledge of of next-level techniques to administer and manage Salesforce's
CRM capabilities through guided scenarios, lecture, and discussion.",Salesforce Administration
cg,215,Prepare for Your Salesforce Administrator Credential,Preparing to sit for your Salesforce Administrator credential? Check out this trailmix that has been curated to help you get exam ready!,Salesforce Administration
cg,216,Administration Essentials for New Admins ADM-201,"Comprehensive and hands-on, Administration Essentials for New Admins
is the core training that ensures your success with Salesforce. It's a must for
new administrators. We recommend administrators take this course before
starting a Salesforce deployment or when taking over an existing deployment.",Salesforce Administration
cg,218,Essentials of Pardot for Digital Marketers (PDT-101),"Are you looking to become proficient in designing and implementing
marketing workflows in Pardot that drive your company's business? Or do you
want to become a Salesforce Certified Pardot Specialist? Whether you are an
experienced user, or completely new to Pardot, this course will show you how
to effectively design, build, and implement marketing workflows, as well as
use Pardot-generated reports to make data-driven decisions.",Digital Marketing
cg,219,Essentials for Marketing Cloud Email Marketers (EEB101),"Email Essentials is designed to get you up and running on the Salesforce
Marketing Cloud Email Application. In this interactive course, email marketers
will gain hands-on experience creating emails, sending and tracking results,
managing subscriber data, segmenting data to deliver targeted, relevant
messages, and learning automation tools to automate campaigns and daily
tasks.",Salesforce Marketing Cloud
cg,221,Salesforce Marketing Cloud Implementation Workshop,"2-day instructor-led workshop to give Partners in-depth discussion and the hands-on experience they need to consult and implement the Marketing Cloud. Get a sound understanding of the Marketing Cloud, including navigation, advanced workflows and configurations, best practices, functionality, and integrations. Smoothly implement and start using the various applications so that clients quickly realize the full value of the Marketing Cloud.",Salesforce Marketing Cloud
