,,title,description,skill
ec,501,Accounting for Decision-Making,"In order for a manager to effectively perform their role they must have an understanding of accounting information, as accounting systems generate information that is used by both internal and external stakeholders</p>
Having a good understanding of accounting allows managers to communicate with the finance department, bankers, suppliers and even tax authorities.</p>
In this finance course, you will learn how to read and understand financial statements. You will learn all relevant and important terms as they relate to the three financial statements - balance sheet, income statement and cash flow statement. Subsequently, you will develop the capability to analyze business performance through financial statements. You will see how the performance of any organization is impacted by four fundamental drivers of profitability - asset management, cost management, leverage management and tax management.</p>
In the second part of the course, you will learn how to manage costs. We will cover product costing, budgeting , budgetary control and cost analysis for decision making.</p>
Successfully completing this course will transform you into a manager who is confident while discussing and handling accounting and financial matters in the workplace, and help you as you move forward in your managerial career and take on senior roles.</p>",Accounting
ec,507,Best Practices for Project Management Success,"Project management plays a key role in supporting a business&rsquo;s success. In this project management course, you will learn what&rsquo;s required from an organization for projects to excel.</p>
You will learn how to turn project management principles and theory into practice. The course will cover:</p>
<ul>
<li>project management methods and best practices</li>
<li>project portfolio management</li>
<li>the project management office</li>
<li>Six Sigma</li>
<li>corporate culture and organizational behavior</li>
<li>project management leadership</li>
</ul>
The course will utilize case studies and examples from companies to help students sharpen their project management skills to recognize and implement an environment that supports success.</p>
First, we will cover the basic organizational and leadership elements required to provide a successful environment for all projects to succeed.</p>
Second, we will cover the necessary organizational support structures and methods that enable project management and project managers to deliver results to the business and to the customers they serve.</p>
Finally, we will explore the challenges of specific types of projects such as projects in crisis, global projects and managing a portfolio.</p>
This course is part of the RIT Project Management MicroMasters Program that is designed to teach the importance of the organizational and leadership characteristics for the success of projects. In order to qualify for the MicroMasters Credential, you will need to earn a verified certificate in each of the three courses as well as pass a capstone exam.</p>",Project Management
ec,508,International Project Management,"Managing global projects presents unique challenges. This course addresses the knowledge, skills and behaviors required to successfully manage projects that span organizations, national boundaries and cultural differences.</p>
In this course we will explore the impact on project management of culture, language variations, religious, regulatory and legal practices, technology penetration, temporal orientation, gender issues, corruption, ethics, personal liberty and political contexts. We learn how to meet global projects challenges through efficient use of practices and technology. The course will utilize available case studies and examples from companies to help students sharpen the skills needed to recognize and foster a successful international project environment.</p>
First, you will learn how culture affects how teams perceive each other, lead, solve problems and execute tasks. Although the world is increasingly connected, the people behind the projects have biases, expectations and a perception of life that impacts all decisions.</p>
Second, you will learn how to effectively manage global teams including how to build trust and collaboration across various cultures, time zones and technological settings. You will learn how to design communication channels and project structures effectively in a global project environment.</p>
Third, you will become familiar with the issues underlying the problem of corruption, which is the abuse of trusted power for private gain. Reducing the risk of corruption strengthens a company’s reputation, builds the respect of employees and raises credibility with key stakeholders.</p>
Finally, you will learn how the adoption of collaboration tools can enhance the global project experience.</p>
This course is part of the RIT Project Management MicroMasters Program that is designed to teach how to successfully deliver projects in an international environment. In order to qualify for the MicroMasters Credential, you will need to earn a verified certificate in each of the three courses as well as pass a capstone exam.</p>",Project Management
ec,510,Android Developer Capstone Project: Building a Successful Android App,"The capstone project includes the evaluation of the competencies and performance tasks, which define an Associate Android Developer</em></strong> (Fundamental Application Components, Application User Interface (UI) and User Experience (UX), Persistent Data Storage, Enhanced System Integration and Testing and Debugging).</p>
You will demonstrate your understanding of the fundamental application components of programming for Android, how to build clean and compelling user interfaces, using view styles and theme attributes to apply a consistent look and feel across an entire application. Your app will connect with the internet sharing preferences and files, SQLite databases, content providers, libraries as ORM or Realm. You will design, plan, build and publish in the Google Play store your own Android Application.</p>
This capstone project is part of the GalileoX  Android Developer</em></strong> MicroMasters Program </em></strong>that is specifically designed to teach the critical skills needed to be successful in this exciting field. In order to qualify for the MicroMasters Credential you will need to earn a Verified Certificate in each of the four courses as well as this final capstone project.</p>",Android Application Development
ec,520,Global Marketing Strategy,"In this marketing course, you will gain an understanding of the foundations, scope, and challenges of global marketing, as well as the cultural environments of global markets.</p>
Organizations and businesses are always facing new challenges including slow domestic market growth, international competition, deregulation of formerly protected industries, short product life cycles, and emergence of global brands. This course will equip you with skills to understand and handle current and developing challenges in global marketing and how to create and implement successful strategies.</p>
This course will help you understand the strategic implications of segmentation, targeting, and positioning and how they are developed within the context of customer, competitor, and context analysis. Particular emphasis will be placed on the role of disruptive positioning strategies and how firms can utilize such strategies to their advantage.</p>
You will develop integrated marketing strategies taking into consideration the problems and perspectives of marketing across national boundaries and within foreign countries. You’ll learn to evaluate and prioritize information that influences marketing decisions and deal with ambiguous information when engaged in business globally. You will also gain understanding of the strategic implications of the Country of Origin Effect and how this influences customer’s information processing of firms and brands.</p>",Marketing Strategy
ec,521,Communicating in a Global Context,"Understand and master strategies for interpersonal encounters, including conflict resolution, in multicultural environments.</p>
Working in a global, cross-cultural role requires effective communication with individuals and groups from different parts of the world. Your success depends on your ability to work effectively with people who may understand and react to situations differently. Therefore, your ability to communicate effectively is a critical requirement. This course uses a dynamic and engaging approach to develop the skills for effective communication in international business settings. We will cover techniques and methods for handling interpersonal encounters in multicultural environments.</p>
You will leave the course with stronger communication skills, knowledge, insights and experiences necessary to be a successful international manager.</p>",Communication Skills
ec,522,Project Management MicroMasters Capstone Exam,"The capstone exam includes the evaluation of the competencies and performance tasks, which define a successful project manager.</strong><br /><br />The capstone exam is the culminating component of the RITx Project Management MicroMasters program that is designed to provide you with the in-depth knowledge and skills needed to be a successful project manager in any industry. In order to qualify for the Project Management MicroMasters credential, you will need to earn a verified certificate in each of the three RITx Project Management MicroMasters courses and pass the verified capstone exam.<br /><br />The capstone exam will test knowledge across all three MicroMasters courses, so it is strongly recommended you complete PM9001x, PM9002x, and PM9003x prior to participating in this exam. It will be a webcam proctored timed exam and will feature problems similar to the graded assignments in the different modules as well as some writing.</p>",Project Management
ec,526,Introduction to Java Programming: Fundamental Data Structures and Algorithms,"In this introductory course, you will learn programming with Java in an easy and interactive way.</p>
You will learn about fundamental data structures, such as lists, stacks, queues and trees, and presents algorithms for inserting, deleting, searching and sorting information on these data structures in an efficient way.</p>
Emphasis is put on immediate feedback and on having a fun experience. Programming knowledge is not only useful to be able to program today’s devices such as computers and smartphones. It also opens the door to computational thinking, i.e. the application of computing techniques to every-day processes.</p>
This course is designed taking into account the subset and recommendations of the College Board in order to prepare learners for the Advanced Placement (AP) Computer Science A exam.</p>",Java
ec,540,Essential Statistics for Data Analysis using Excel,"This course is part of the <a href=""../../../../microsoft-professional-program-certficate-data-science"">Microsoft Professional Program Certificate in Data Science</em></a>.</p>
If you&rsquo;re considering a career as a data analyst, you need to know about histograms, Pareto charts, Boxplots, Bayes&rsquo; theorem, and much more. In this applied statistics course, the second in our Microsoft Excel Data Analyst XSeries, use the powerful tools built into Excel, and explore the core principles of statistics and basic probability&mdash;from both the conceptual and applied perspectives. Learn about descriptive statistics, basic probability, random variables, sampling and confidence intervals, and hypothesis testing. And see how to apply these concepts and principles using the environment, functions, and visualizations of Excel.</p>
As a data science pro, the ability to analyze data helps you to make better decisions, and a solid foundation in statistics and basic probability helps you to better understand your data. Using real-world concepts applicable to many industries, including medical, business, sports, insurance, and much more, learn from leading experts why Excel is one of the top tools for data analysis and how its built-in features make Excel a great way to learn essential skills.</p>
Before taking this course, you should be familiar with organizing and summarizing data using Excel analytic tools, such as tables, pivot tables, and pivot charts. You should also be comfortable (or willing to try) creating complex formulas and visualizations. Want to start with the basics? Check out <a href=""https://aka.ms/edx-dat205x-about"" target=""_blank"" rel=""noopener noreferrer"">DAT205x: Introduction to Data Analysis using Excel</a>. As you learn these concepts and get more experience with this powerful tool that can be extremely helpful in your journey as a data analyst or data scientist, you may want to also take the third course in our series, <a href=""https://aka.ms/edx-dat206x-about"" target=""_blank"" rel=""noopener noreferrer"">DAT206x Analyzing and Visualizing Data with Excel</a>. This course includes excerpts from Microsoft Excel 2016: Data Analysis and Business Modeling from Microsoft Press and authored by course instructor Wayne Winston.</p>
This course is also part of the <a href=""https://www.edx.org/xseries/microsoft-excel-data-analyst"">Microsoft Excel for the Data Analyst XSeries</a>.<br /><br />edX offers financial assistance for learners who want to earn Verified Certificates but who may not be able to pay the fee. To apply for financial assistance, enroll in the course, then follow <a href=""https://courses.edx.org/financial-assistance/"">this link</a> to complete an application for assistance.</p>",Data Analysis
ec,541,Financial Accounting Made Fun: Eliminating Your Fears,"Are financial statements a mystery to you? Do all those terms and metrics make your head spin? Do you avoid conversations with your finance leaders because you are not confident of your finance ability?</p>
Having a solid understanding of financial terms, statements and metrics is critical to becoming a successful entrepreneur or manager. In this finance course, you will learn how to interpret and use the information contained in financial statements to make key operating decisions, evaluate business performance, and create forecasts of profits and cash flow.</p>
This course introduces you to the form, content and definitions included in the primary financial statements: income statement, balance sheet, and cash flow statement. You will learn how to use this information to make key operating decisions, such as how to balance growth with cash constraints. You will learn how to use ratios to diagnose a company’s financial health and apply these concepts and tools to evaluate a company of your own choosing.</p>
Eliminate your fear of accounting! Financial accounting can be fun once the barriers to learning are broken down. Through a series of learning scenarios that take you through the creation of a simple business, you will become comfortable with basic accounting tools and concepts that you need to more effectively manage your business. By the end of the course, you will become a much more confident user of financial information and will be able to effectively engage with your finance leaders.</p>
This course is part of the Business Principles and Entrepreneurial Thought XSeries.</p>",Accounting
ec,542,Marketing Fundamentals: Who Is Your Customer?,"In order to compete in an ever-changing market, business leaders must assess and respond to consumer needs and wants. Marketing is a means of creating value for consumers and engendering loyalty and enthusiasm for your product or service.</p>
If you’re starting or running a business, identifying and targeting your consumers is the single most important decision you can make. Business leaders often wrongly believe that every customer is a good customer. This is not always the case; knowing which customers to let go of is just as important as finding customers. In this marketing course, you will learn how to assess the value you provide to the consumer as well as the value the customer offers your business.</p>
The course will also provide you with a toolkit you can apply to real world situations. Topics include:</p>
<ul>
<li>the marketing mix</li>
<li>segmentation</li>
<li>targeting and positioning</li>
<li>marketing strategy</li>
<li>consumer behavior</li>
</ul>
Marketing is often an afterthought for entrepreneurs as they focus on getting their venture off the ground. You will learn how marketing is a vital part of launching a successful business, and for keeping one running, and how marketing concepts can be applied to entrepreneurial situations. By the end of the course, you will be thinking about marketing strategically in order to grow your business, rather than as a tactical cost.</p>
This course is part of the Business Principles and Entrepreneurial Thought XSeries.</p>",Marketing Analytics
ec,544,Financial Analysis for Decision Making,"How do you find the money necessary to effectively manage your business? How do you know if a business opportunity is worthwhile? When should you invest in a stock, bond or company? Do you fear the financial side of growing your organization?</p>
This finance course will take the mystery out of financial analysis and help you make the right business decisions. In order to establish your company you need to secure funding. Once you have money, you need to determine the most efficient and effective use of your capital. You also need to have the knowledge to have professional and engaging conversations with finance professionals who control access to funding.</p>
In this course, you will discover a variety of options for funding your business and how to successfully negotiate financial opportunities. You will learn how to value and evaluate ideas to determine the appropriate benefits and costs in order to screen them correctly. Finally, you will learn how to value a business and the securities you can use to potentially fund your organization.</p>
This course is part of the Business Principles and Entrepreneurial Thought XSeries.</p>",Financial Analysis
ec,546,Analyzing Big Data with Microsoft R,"This course is part of the&nbsp;<a href=""https://www.edx.org/microsoft-professional-program-certficate-data-science"" target=""_blank"" rel=""noopener noreferrer"">Microsoft Professional Program Certificate in Data Science</a> and the <a href=""https://www.edx.org/microsoft-professional-program-big-data"" target=""_blank"" rel=""noopener noreferrer"">Microsoft Professional Program Certificate in Big Data</a>..<br /><br />The open-source programming language R has for a long time been popular (particularly in academia) for data processing and statistical analysis. Among R's strengths are that it's a succinct programming language and has an extensive repository of third party libraries for performing all kinds of analyses. Together, these two features make it possible for a data scientist to very quickly go from raw data to summaries, charts, and even full-blown reports. However, one deficiency with R is that traditionally it uses a lot of memory, both because it needs to load a copy of the data in its entirety as a data.frame object, and also because processing the data often involves making further copies (sometimes referred to as copy-on-modify). This is one of the reasons R has been more reluctantly received by industry compared to academia.</p>
The main component of Microsoft R Server (MRS) is the RevoScaleR package, which is an R library that offers a set of functionalities for processing large datasets without having to load them all at once in the memory. RevoScaleR offers a rich set of distributed statistical and machine learning algorithms, which get added to over time. Finally, RevoScaleR also offers a mechanism by which we can take code that we developed on our laptop and deploy it on a remote server such as SQL Server or Spark (where the infrastructure is very different under the hood), with minimal effort.</p>
In this course, we will show you how to use MRS to run an analysis on a large dataset and provide some examples of how to deploy it on a Spark cluster or a SQL Server database. Upon completion, you will know how to use R for big-data problems.</p>
Since RevoScaleR is an R package, we assume that the course participants are familiar with R. A solid understanding of R data structures (vectors, matrices, lists, data frames, environments) is required.&nbsp;Familiarity with 3rd party packages such as dplyr is also helpful.<br /><br />edX offers financial assistance for learners who want to earn Verified Certificates but who may not be able to pay the fee. To apply for financial assistance, enroll in the course, then follow <a href=""https://courses.edx.org/financial-assistance/"">this link</a> to complete an application for assistance.</p>",R
ec,548,Analytics for Decision Making,"Want to know how to avoid bad decisions with data?</p>
Making good decisions with data can give you a distinct competitive advantage in business. This statistics and data analysis course will help you understand the fundamental concepts of sound statistical thinking that can be applied in surprisingly wide contexts, sometimes even before there is any data! Key concepts like understanding variation, perceiving relative risk of alternative decisions, and pinpointing sources of variation will be highlighted.</p>
These big picture ideas have motivated the development of quantitative models, but in most traditional statistics courses, these concepts get lost behind a wall of little techniques and computations. In this course we keep the focus on the ideas that really matter, and we illustrate them with lively, practical, accessible examples.</p>
We will explore questions like: How are traditional statistical methods still relevant in modern analytics applications? How can we avoid common fallacies and misconceptions when approaching quantitative problems? How do we apply statistical methods in predictive applications? How do we gain a better understanding of customer engagement through analytics?</p>
This course will be is relevant for anyone eager to have a framework for good decision-making. It will be good preparation for students with a bachelor’s degree contemplating graduate study in a business field.</p>
Opportunities in analytics are abundant at the moment. Specific techniques or software packages may be helpful in landing first jobs, but those techniques and packages may soon be replaced by something newer and trendier. Understanding the ways in which quantitative models really work, however, is a management level skill that is unlikely to go out of style.</p>
This course is part of the Business Principles and Entrepreneurial Thought XSeries.</p>",Decision Making
ec,552,Introduction to NoSQL Data Solutions,"This course is part of the <a href=""https://www.edx.org/microsoft-big-data"">Microsoft Professional Program Certificate in Big Data</em></a>.</p>
As a data pro, you know that some scenarios&mdash;particularly those involving real-time analytics, site personalization, IoT, and mobile apps&mdash;are better addressed with NoSQL storage and compute solutions than they are with relational databases. Microsoft Azure has several NoSQL (or &ldquo;Not Only SQL&rdquo;) non-relational data storage options to choose from. NoSQL databases are generally built to be distributed and partitioned across many servers. And they&rsquo;re built to scale out for high availability and to be flexible enough to handle semi-structured and unstructured data. If you have a data model that is constantly evolving and you want to move fast, that&rsquo;s what these databases are about.</p>
In this practical course, complete with labs, assessments, and a final exam, join the experts to learn how NoSQL has evolved over time. Explore non-relational data storage options in Azure, and see how to use them in your applications. Find out how to create, store, manage, and access data in these different storage options. Get an in-depth look at Azure Table Storage, DocumentDB, MongoDB, and more. Learn about the &ldquo;three Vs&rdquo;&mdash;variety (schemas or scenarios that evolve quickly), volume (scale in terms of data storage), and velocity (throughput needs to support a large user base). Take this opportunity to get hands-on with NoSQL options in Azure.</p>",NoSQL
ec,557,Processing Big Data with Azure Data Lake Analytics,"This course is part of the <a href=""https://www.edx.org/microsoft-professional-program-big-data"" target=""_blank"" rel=""noopener noreferrer"">Microsoft Professional Program Certificate in Big Data</a>.<br /><br />Want to store and process data at scale? This data analysis course teaches you how to apply the power of the Azure cloud to big data using Azure Data Lake technologies.</p>
Learn how to manage data in Azure Data Lake Store and run U-SQL jobs in Azure Data Lake Analytics to generate insights from structured and unstructured data sources.</p>
Note: </strong>To complete this course, you will need a Microsoft Azure subscription. You can sign up for a free trial subscription at http://azure.microsoft.com, or you can use your existing subscription. The labs have been designed to minimize the resource costs required to complete the hands-on activities.</em></p>",Microsoft Azure
